Event,Details
1. Event: Apple's Q2 2023 Earnings Release,"Description: Apple is set to release its Q2 2023 earnings report on April 26, 2023. This report will include details about the company's financial performance during the first quarter of the calendar year, including revenue, profits, and sales numbers for various product lines. Potential Impact: The earnings report could cause significant market disruptions depending on the company's financial performance. If Apple's earnings beat expectations, the stock price could rise, potentially leading to a positive market reaction. Conversely, if the earnings fall short of expectations, the stock price could drop, potentially causing negative market reverberations."
2. Event: Apple's Spring Product Launch Event,"Description: Apple is rumored to be holding a product launch event in March 2023, where it is expected to unveil new versions of the iPad Pro, MacBook Pro, and AirPods. This event will provide insight into the company's product strategy and potential revenue growth areas. Potential Impact: The product launch event could cause market disruptions if the new products are well-received by consumers and investors. If the new products are seen as innovative and competitive, it could lead to increased demand and a rise in Apple's stock price. However, if the new products are viewed as underwhelming or overpriced, it could lead to decreased demand and a drop in the stock price."
3. Event: US-China Trade Tensions,"Description: Ongoing trade tensions between the US and China could negatively impact Apple's supply chain and profitability. The company has a significant manufacturing presence in China, and any escalation in trade tensions could lead to increased tariffs or supply chain disruptions. Potential Impact: Increased trade tensions could lead to negative market reactions due to concerns about Apple's ability to maintain its current level of profitability. If tariffs are imposed or supply chain disruptions occur, it could lead to increased costs, decreased sales, and a drop in the stock price."
4. Event: Apple's AR/VR Product Development,"Description: Apple is rumored to be developing augmented reality (AR) and virtual reality (VR) products, with a potential release date in 2023. These products could represent a significant new revenue stream for the company and position it as a leader in the AR/VR market. Potential Impact: The release of AR/VR products could cause market disruptions if they are well-received by consumers and investors. If the products are seen as innovative and competitive, it could lead to increased demand, a rise in Apple's stock price, and potential market share gains in the AR/VR market."
5. Event: Regulatory Scrutiny of Big Tech,"Description: Apple, along with other big tech companies, is facing increased regulatory scrutiny in the US and Europe. This scrutiny could lead to antitrust investigations, fines, and potential changes in the company's business practices. Potential Impact: Increased regulatory scrutiny could lead to negative market reactions due to concerns about Apple's future profitability and potential business model changes. If the company is fined or required to make significant changes to its business practices, it could lead to decreased sales, increased costs, and a drop in the stock price."
